code,naics_title,sector,borderline
111110,soybean farming,not in scope,FALSE
111120,oilseed (except soybean) farming,not in scope,FALSE
111130,dry pea and bean farming,not in scope,FALSE
111140,wheat farming,not in scope,FALSE
111150,corn farming,not in scope,FALSE
111160,rice farming,not in scope,FALSE
111191,oilseed and grain combination farming,not in scope,FALSE
111199,all other grain farming,not in scope,FALSE
111211,potato farming,not in scope,FALSE
111219,other vegetable (except potato) and melon farming,not in scope,FALSE
111310,orange groves,not in scope,FALSE
111320,citrus (except orange) groves,not in scope,FALSE
111331,apple orchards,not in scope,FALSE
111332,grape vineyards,not in scope,FALSE
111333,strawberry farming,not in scope,FALSE
111334,berry (except strawberry) farming,not in scope,FALSE
111335,tree nut farming,not in scope,FALSE
111336,fruit and tree nut combination farming,not in scope,FALSE
111339,other noncitrus fruit farming,not in scope,FALSE
111411,mushroom production,not in scope,FALSE
111419,other food crops grown under cover,not in scope,FALSE
111421,nursery and tree production,not in scope,FALSE
111422,floriculture production,not in scope,FALSE
111910,tobacco farming,not in scope,FALSE
111920,cotton farming,not in scope,FALSE
111930,sugarcane farming,not in scope,FALSE
111940,hay farming,not in scope,FALSE
111991,sugar beet farming,not in scope,FALSE
111992,peanut farming,not in scope,FALSE
111998,all other miscellaneous crop farming,not in scope,FALSE
112111,beef cattle ranching and farming,not in scope,FALSE
112112,cattle feedlots,not in scope,FALSE
112120,dairy cattle and milk production,not in scope,FALSE
112130,dual-purpose cattle ranching and farming,not in scope,FALSE
112210,hog and pig farming,not in scope,FALSE
112310,chicken egg production,not in scope,FALSE
112320,broilers and other meat type chicken production,not in scope,FALSE
112330,turkey production,not in scope,FALSE
112340,poultry hatcheries,not in scope,FALSE
112390,other poultry production,not in scope,FALSE
112410,sheep farming,not in scope,FALSE
112420,goat farming,not in scope,FALSE
112511,finfish farming and fish hatcheries,not in scope,FALSE
112512,shellfish farming,not in scope,FALSE
112519,other aquaculture,not in scope,FALSE
112910,apiculture,not in scope,FALSE
112920,horses and other equine production,not in scope,FALSE
112930,fur-bearing animal and rabbit production,not in scope,FALSE
112990,all other animal production,not in scope,FALSE
113110,timber tract operations,not in scope,FALSE
113210,forest nurseries and gathering of forest products,not in scope,FALSE
113310,logging,not in scope,FALSE
114111,finfish fishing,not in scope,FALSE
114112,shellfish fishing,not in scope,FALSE
114119,other marine fishing,not in scope,FALSE
114210,hunting and trapping,not in scope,FALSE
115111,cotton ginning,not in scope,FALSE
115112,"soil preparation, planting, and cultivating",not in scope,FALSE
115113,"crop harvesting, primarily by machine",not in scope,FALSE
115114,postharvest crop activities (except cotton ginning),not in scope,FALSE
115115,farm labor contractors and crew leaders,not in scope,FALSE
115116,farm management services,not in scope,FALSE
115210,support activities for animal production,not in scope,FALSE
115310,support activities for forestry,not in scope,FALSE
211120,crude petroleum extraction ,oil and gas,FALSE
211130,natural gas extraction,oil and gas,FALSE
212111,bituminous coal and lignite surface mining,coal,FALSE
212112,bituminous coal underground mining,coal,FALSE
212113,anthracite mining,coal,FALSE
212210,iron ore mining,not in scope,FALSE
212221,gold ore mining,not in scope,FALSE
212222,silver ore mining,not in scope,FALSE
212230,"copper, nickel, lead, and zinc mining",not in scope,FALSE
212291,uranium-radium-vanadium ore mining,not in scope,FALSE
212299,all other metal ore mining,not in scope,FALSE
212311,dimension stone mining and quarrying,not in scope,FALSE
212312,crushed and broken limestone mining and quarrying,not in scope,FALSE
212313,crushed and broken granite mining and quarrying,not in scope,FALSE
212319,other crushed and broken stone mining and quarrying,not in scope,FALSE
212321,construction sand and gravel mining,not in scope,FALSE
212322,industrial sand mining,not in scope,FALSE
212324,kaolin and ball clay mining,not in scope,FALSE
212325,clay and ceramic and refractory minerals mining,not in scope,FALSE
212391,"potash, soda, and borate mineral mining",not in scope,FALSE
212392,phosphate rock mining,not in scope,FALSE
212393,other chemical and fertilizer mineral mining,not in scope,FALSE
212399,all other nonmetallic mineral mining,not in scope,FALSE
213111,drilling oil and gas wells,not in scope,FALSE
213112,support activities for oil and gas operations,not in scope,FALSE
213113,support activities for coal mining,not in scope,FALSE
213114,support activities for metal mining,not in scope,FALSE
213115,support activities for nonmetallic minerals (except fuels) mining,not in scope,FALSE
221111,hydroelectric power generation,power,FALSE
221112,fossil fuel electric power generation,power,FALSE
221113,nuclear electric power generation,power,FALSE
221114,solar electric power generation,power,FALSE
221115,wind electric power generation,power,FALSE
221116,geothermal electric power generation,power,FALSE
221117,biomass electric power generation,power,FALSE
221118,other electric power generation,power,FALSE
221121,electric bulk power transmission and control,power,TRUE
221122,electric power distribution,power,TRUE
221210,natural gas distribution,not in scope,FALSE
221310,water supply and irrigation systems,not in scope,FALSE
221320,sewage treatment facilities,not in scope,FALSE
221330,steam and air-conditioning supply,not in scope,FALSE
236115,new single-family housing construction (except for-sale builders),not in scope,FALSE
236116,new multifamily housing construction (except for-sale builders),not in scope,FALSE
236117,new housing for-sale builders,not in scope,FALSE
236118,residential remodelers,not in scope,FALSE
236210,industrial building construction,not in scope,FALSE
236220,commercial and institutional building construction,not in scope,FALSE
237110,water and sewer line and related structures construction,not in scope,FALSE
237120,oil and gas pipeline and related structures construction,not in scope,FALSE
237130,power and communication line and related structures construction,not in scope,FALSE
237210,land subdivision,not in scope,FALSE
237310,"highway, street, and bridge construction",not in scope,FALSE
237990,other heavy and civil engineering construction,not in scope,FALSE
238110,poured concrete foundation and structure contractors,not in scope,FALSE
238120,structural steel and precast concrete contractors,not in scope,FALSE
238130,framing contractors,not in scope,FALSE
238140,masonry contractors,not in scope,FALSE
238150,glass and glazing contractors,not in scope,FALSE
238160,roofing contractors,not in scope,FALSE
238170,siding contractors,not in scope,FALSE
238190,"other foundation, structure, and building exterior contractors",not in scope,FALSE
238210,electrical contractors and other wiring installation contractors,not in scope,FALSE
238220,"plumbing, heating, and air-conditioning contractors",not in scope,FALSE
238290,other building equipment contractors,not in scope,FALSE
238310,drywall and insulation contractors,not in scope,FALSE
238320,painting and wall covering contractors,not in scope,FALSE
238330,flooring contractors,not in scope,FALSE
238340,tile and terrazzo contractors,not in scope,FALSE
238350,finish carpentry contractors,not in scope,FALSE
238390,other building finishing contractors,not in scope,FALSE
238910,site preparation contractors,not in scope,FALSE
238990,all other specialty trade contractors,not in scope,FALSE
311111,dog and cat food manufacturing,not in scope,FALSE
311119,other animal food manufacturing,not in scope,FALSE
311211,flour milling,not in scope,FALSE
311212,rice milling,not in scope,FALSE
311213,malt manufacturing,not in scope,FALSE
311221,wet corn milling,not in scope,FALSE
311224,soybean and other oilseed processing,not in scope,FALSE
311225,fats and oils refining and blending,not in scope,FALSE
311230,breakfast cereal manufacturing,not in scope,FALSE
311313,beet sugar manufacturing,not in scope,FALSE
311314,cane sugar manufacturing,not in scope,FALSE
311340,nonchocolate confectionery manufacturing,not in scope,FALSE
311351,chocolate and confectionery manufacturing from cacao beans,not in scope,FALSE
311352,confectionery manufacturing from purchased chocolate,not in scope,FALSE
311411,"frozen fruit, juice, and vegetable manufacturing",not in scope,FALSE
311412,frozen specialty food manufacturing,not in scope,FALSE
311421,fruit and vegetable canning,not in scope,FALSE
311422,specialty canning,not in scope,FALSE
311423,dried and dehydrated food manufacturing,not in scope,FALSE
311511,fluid milk manufacturing,not in scope,FALSE
311512,creamery butter manufacturing,not in scope,FALSE
311513,cheese manufacturing,not in scope,FALSE
311514,"dry, condensed, and evaporated dairy product manufacturing",not in scope,FALSE
311520,ice cream and frozen dessert manufacturing,not in scope,FALSE
311611,animal (except poultry) slaughtering,not in scope,FALSE
311612,meat processed from carcasses,not in scope,FALSE
311613,rendering and meat byproduct processing,not in scope,FALSE
311615,poultry processing,not in scope,FALSE
311710,seafood product preparation and packaging,not in scope,FALSE
311811,retail bakeries,not in scope,FALSE
311812,commercial bakeries,not in scope,FALSE
311813,"frozen cakes, pies, and other pastries manufacturing",not in scope,FALSE
311821,cookie and cracker manufacturing,not in scope,FALSE
311824,"dry pasta, dough, and flour mixes manufacturing from purchased flour",not in scope,FALSE
311830,tortilla manufacturing,not in scope,FALSE
311911,roasted nuts and peanut butter manufacturing,not in scope,FALSE
311919,other snack food manufacturing,not in scope,FALSE
311920,coffee and tea manufacturing,not in scope,FALSE
311930,flavoring syrup and concentrate manufacturing,not in scope,FALSE
311941,"mayonnaise, dressing, and other prepared sauce manufacturing",not in scope,FALSE
311942,spice and extract manufacturing,not in scope,FALSE
311991,perishable prepared food manufacturing,not in scope,FALSE
311999,all other miscellaneous food manufacturing,not in scope,FALSE
312111,soft drink manufacturing,not in scope,FALSE
312112,bottled water manufacturing,not in scope,FALSE
312113,ice manufacturing,not in scope,FALSE
312120,breweries,not in scope,FALSE
312130,wineries,not in scope,FALSE
312140,distilleries,not in scope,FALSE
312230,tobacco manufacturing,not in scope,FALSE
313110,"fiber, yarn, and thread mills",not in scope,FALSE
313210,broadwoven fabric mills,not in scope,FALSE
313220,narrow fabric mills and schiffli machine embroidery,not in scope,FALSE
313230,nonwoven fabric mills,not in scope,FALSE
313240,knit fabric mills,not in scope,FALSE
313310,textile and fabric finishing mills,not in scope,FALSE
313320,fabric coating mills,not in scope,FALSE
314110,carpet and rug mills,not in scope,FALSE
314120,curtain and linen mills,not in scope,FALSE
314910,textile bag and canvas mills,not in scope,FALSE
314994,"rope, cordage, twine, tire cord, and tire fabric mills",not in scope,FALSE
314999,all other miscellaneous textile product mills,not in scope,FALSE
315110,hosiery and sock mills,not in scope,FALSE
315190,other apparel knitting mills,not in scope,FALSE
315210,cut and sew apparel contractors,not in scope,FALSE
315220,men’s and boys’ cut and sew apparel manufacturing,not in scope,FALSE
315240,"women’s, girls’, and infants’ cut and sew apparel manufacturing",not in scope,FALSE
315280,other cut and sew apparel manufacturing,not in scope,FALSE
315990,apparel accessories and other apparel manufacturing,not in scope,FALSE
316110,leather and hide tanning and finishing,not in scope,FALSE
316210,footwear manufacturing,not in scope,FALSE
316992,women's handbag and purse manufacturing,not in scope,FALSE
316998,all other leather good and allied product manufacturing,not in scope,FALSE
321113,sawmills,not in scope,FALSE
321114,wood preservation,not in scope,FALSE
321211,hardwood veneer and plywood manufacturing,not in scope,FALSE
321212,softwood veneer and plywood manufacturing,not in scope,FALSE
321213,engineered wood member (except truss) manufacturing,not in scope,FALSE
321214,truss manufacturing,not in scope,FALSE
321219,reconstituted wood product manufacturing,not in scope,FALSE
321911,wood window and door manufacturing,not in scope,FALSE
321912,"cut stock, resawing lumber, and planing",not in scope,FALSE
321918,other millwork (including flooring),not in scope,FALSE
321920,wood container and pallet manufacturing,not in scope,FALSE
321991,manufactured home (mobile home) manufacturing,not in scope,FALSE
321992,prefabricated wood building manufacturing,not in scope,FALSE
321999,all other miscellaneous wood product manufacturing,not in scope,FALSE
322110,pulp mills,not in scope,FALSE
322121,paper (except newsprint) mills,not in scope,FALSE
322122,newsprint mills,not in scope,FALSE
322130,paperboard mills,not in scope,FALSE
322211,corrugated and solid fiber box manufacturing,not in scope,FALSE
322212,folding paperboard box manufacturing,not in scope,FALSE
322219,other paperboard container manufacturing,not in scope,FALSE
322220,paper bag and coated and treated paper manufacturing,not in scope,FALSE
322230,stationery product manufacturing,not in scope,FALSE
322291,sanitary paper product manufacturing,not in scope,FALSE
322299,all other converted paper product manufacturing,not in scope,FALSE
323111,commercial printing (except screen and books),not in scope,FALSE
323113,commercial screen printing,not in scope,FALSE
323117,books printing,not in scope,FALSE
323120,support activities for printing,not in scope,FALSE
324110,petroleum refineries,not in scope,FALSE
324121,asphalt paving mixture and block manufacturing,not in scope,FALSE
324122,asphalt shingle and coating materials manufacturing,not in scope,FALSE
324191,petroleum lubricating oil and grease manufacturing,not in scope,FALSE
324199,all other petroleum and coal products manufacturing,not in scope,FALSE
325110,petrochemical manufacturing,not in scope,FALSE
325120,industrial gas manufacturing,not in scope,FALSE
325130,synthetic dye and pigment manufacturing,not in scope,FALSE
325180,other basic inorganic chemical manufacturing,not in scope,FALSE
325193,ethyl alcohol manufacturing,not in scope,FALSE
325194,"cyclic crude, intermediate, and gum and wood chemical manufacturing",not in scope,FALSE
325199,all other basic organic chemical manufacturing,not in scope,FALSE
325211,plastics material and resin manufacturing,not in scope,FALSE
325212,synthetic rubber manufacturing,not in scope,FALSE
325220,artificial and synthetic fibers and filaments manufacturing,not in scope,FALSE
325311,nitrogenous fertilizer manufacturing,not in scope,FALSE
325312,phosphatic fertilizer manufacturing,not in scope,FALSE
325314,fertilizer (mixing only) manufacturing,not in scope,FALSE
325320,pesticide and other agricultural chemical manufacturing,not in scope,FALSE
325411,medicinal and botanical manufacturing,not in scope,FALSE
325412,pharmaceutical preparation manufacturing,not in scope,FALSE
325413,in-vitro diagnostic substance manufacturing,not in scope,FALSE
325414,biological product (except diagnostic) manufacturing,not in scope,FALSE
325510,paint and coating manufacturing,not in scope,FALSE
325520,adhesive manufacturing,not in scope,FALSE
325611,soap and other detergent manufacturing,not in scope,FALSE
325612,polish and other sanitation good manufacturing,not in scope,FALSE
325613,surface active agent manufacturing,not in scope,FALSE
325620,toilet preparation manufacturing,not in scope,FALSE
325910,printing ink manufacturing,not in scope,FALSE
325920,explosives manufacturing,not in scope,FALSE
325991,custom compounding of purchased resins,not in scope,FALSE
325992,"photographic film, paper, plate, and chemical manufacturing",not in scope,FALSE
325998,all other miscellaneous chemical product and preparation manufacturing,not in scope,FALSE
326111,plastics bag and pouch manufacturing,not in scope,FALSE
326112,plastics packaging film and sheet (including laminated) manufacturing,not in scope,FALSE
326113,unlaminated plastics film and sheet (except packaging) manufacturing,not in scope,FALSE
326121,unlaminated plastics profile shape manufacturing,not in scope,FALSE
326122,plastics pipe and pipe fitting manufacturing,not in scope,FALSE
326130,"laminated plastics plate, sheet (except packaging), and shape manufacturing",not in scope,FALSE
326140,polystyrene foam product manufacturing,not in scope,FALSE
326150,urethane and other foam product (except polystyrene) manufacturing,not in scope,FALSE
326160,plastics bottle manufacturing,not in scope,FALSE
326191,plastics plumbing fixture manufacturing,not in scope,FALSE
326199,all other plastics product manufacturing,not in scope,FALSE
326211,tire manufacturing (except retreading),not in scope,FALSE
326212,tire retreading,not in scope,FALSE
326220,rubber and plastics hoses and belting manufacturing,not in scope,FALSE
326291,rubber product manufacturing for mechanical use,not in scope,FALSE
326299,all other rubber product manufacturing,not in scope,FALSE
327110,"pottery, ceramics, and plumbing fixture manufacturing",not in scope,FALSE
327120,clay building material and refractories manufacturing,not in scope,FALSE
327211,flat glass manufacturing,not in scope,FALSE
327212,other pressed and blown glass and glassware manufacturing,not in scope,FALSE
327213,glass container manufacturing,not in scope,FALSE
327215,glass product manufacturing made of purchased glass,not in scope,FALSE
327310,cement manufacturing,cement,FALSE
327320,ready-mix concrete manufacturing,not in scope,FALSE
327331,concrete block and brick manufacturing,not in scope,FALSE
327332,concrete pipe manufacturing,not in scope,FALSE
327390,other concrete product manufacturing,not in scope,FALSE
327410,lime manufacturing,not in scope,FALSE
327420,gypsum product manufacturing,not in scope,FALSE
327910,abrasive product manufacturing,not in scope,FALSE
327991,cut stone and stone product manufacturing,not in scope,FALSE
327992,ground or treated mineral and earth manufacturing,not in scope,FALSE
327993,mineral wool manufacturing,not in scope,FALSE
327999,all other miscellaneous nonmetallic mineral product manufacturing,not in scope,FALSE
331110,iron and steel mills and ferroalloy manufacturing,steel,FALSE
331210,iron and steel pipe and tube manufacturing from purchased steel,steel,TRUE
331221,rolled steel shape manufacturing,steel,TRUE
331222,steel wire drawing,steel,TRUE
331313,alumina refining and primary aluminum production,not in scope,FALSE
331314,secondary smelting and alloying of aluminum,not in scope,FALSE
331315,"aluminum sheet, plate, and foil manufacturing",not in scope,FALSE
331318,"other aluminum rolling, drawing, and extruding",not in scope,FALSE
331410,nonferrous metal (except aluminum) smelting and refining,not in scope,FALSE
331420,"copper rolling, drawing, extruding, and alloying",not in scope,FALSE
331491,"nonferrous metal (except copper and aluminum) rolling, drawing, and extruding",not in scope,FALSE
331492,"secondary smelting, refining, and alloying of nonferrous metal (except copper and aluminum)",not in scope,FALSE
331511,iron foundries,not in scope,FALSE
331512,steel investment foundries,steel,FALSE
331513,steel foundries (except investment),steel,FALSE
331523,nonferrous metal die-casting foundries,not in scope,FALSE
331524,aluminum foundries (except die-casting),not in scope,FALSE
331529,other nonferrous metal foundries (except die-casting),not in scope,FALSE
332111,iron and steel forging,not in scope,FALSE
332112,nonferrous forging,not in scope,FALSE
332114,custom roll forming,not in scope,FALSE
332117,powder metallurgy part manufacturing,not in scope,FALSE
332119,"metal crown, closure, and other metal stamping (except automotive)",not in scope,FALSE
332215,"metal kitchen cookware, utensil, cutlery, and flatware (except precious) manufacturing",not in scope,FALSE
332216,saw blade and handtool manufacturing,not in scope,FALSE
332311,prefabricated metal building and component manufacturing,not in scope,FALSE
332312,fabricated structural metal manufacturing,not in scope,FALSE
332313,plate work manufacturing,not in scope,FALSE
332321,metal window and door manufacturing,not in scope,FALSE
332322,sheet metal work manufacturing,not in scope,FALSE
332323,ornamental and architectural metal work manufacturing,not in scope,FALSE
332410,power boiler and heat exchanger manufacturing,not in scope,FALSE
332420,metal tank (heavy gauge) manufacturing,not in scope,FALSE
332431,metal can manufacturing,not in scope,FALSE
332439,other metal container manufacturing,not in scope,FALSE
332510,hardware manufacturing,not in scope,FALSE
332613,spring manufacturing,not in scope,FALSE
332618,other fabricated wire product manufacturing,not in scope,FALSE
332710,machine shops,not in scope,FALSE
332721,precision turned product manufacturing,not in scope,FALSE
332722,"bolt, nut, screw, rivet, and washer manufacturing",not in scope,FALSE
332811,metal heat treating,not in scope,FALSE
332812,"metal coating, engraving (except jewelry and silverware), and allied services to manufacturers",not in scope,FALSE
332813,"electroplating, plating, polishing, anodizing, and coloring",not in scope,FALSE
332911,industrial valve manufacturing,not in scope,FALSE
332912,fluid power valve and hose fitting manufacturing,not in scope,FALSE
332913,plumbing fixture fitting and trim manufacturing,not in scope,FALSE
332919,other metal valve and pipe fitting manufacturing,not in scope,FALSE
332991,ball and roller bearing manufacturing,not in scope,FALSE
332992,small arms ammunition manufacturing,not in scope,FALSE
332993,ammunition (except small arms) manufacturing,not in scope,FALSE
332994,"small arms, ordnance, and ordnance accessories manufacturing",not in scope,FALSE
332996,fabricated pipe and pipe fitting manufacturing,not in scope,FALSE
332999,all other miscellaneous fabricated metal product manufacturing,not in scope,FALSE
333111,farm machinery and equipment manufacturing,not in scope,FALSE
333112,lawn and garden tractor and home lawn and garden equipment manufacturing,not in scope,FALSE
333120,construction machinery manufacturing,not in scope,FALSE
333131,mining machinery and equipment manufacturing,not in scope,FALSE
333132,oil and gas field machinery and equipment manufacturing,not in scope,FALSE
333241,food product machinery manufacturing,not in scope,FALSE
333242,semiconductor machinery manufacturing,not in scope,FALSE
333243,"sawmill, woodworking, and paper machinery manufacturing",not in scope,FALSE
333244,printing machinery and equipment manufacturing,not in scope,FALSE
333249,other industrial machinery manufacturing,not in scope,FALSE
333314,optical instrument and lens manufacturing,not in scope,FALSE
333316,photographic and photocopying equipment manufacturing,not in scope,FALSE
333318,other commercial and service industry machinery manufacturing,not in scope,FALSE
333413,industrial and commercial fan and blower and air purification equipment manufacturing,not in scope,FALSE
333414,heating equipment (except warm air furnaces) manufacturing,not in scope,FALSE
333415,air-conditioning and warm air heating equipment and commercial and industrial refrigeration equipment manufacturing,not in scope,FALSE
333511,industrial mold manufacturing,not in scope,FALSE
333514,"special die and tool, die set, jig, and fixture manufacturing",not in scope,FALSE
333515,cutting tool and machine tool accessory manufacturing,not in scope,FALSE
333517,machine tool manufacturing,not in scope,FALSE
333519,rolling mill and other metalworking machinery manufacturing,not in scope,FALSE
333611,turbine and turbine generator set units manufacturing,not in scope,FALSE
333612,"speed changer, industrial high-speed drive, and gear manufacturing",not in scope,FALSE
333613,mechanical power transmission equipment manufacturing,not in scope,FALSE
333618,other engine equipment manufacturing,not in scope,FALSE
333912,air and gas compressor manufacturing,not in scope,FALSE
333914,"measuring, dispensing, and other pumping equipment manufacturing",not in scope,FALSE
333921,elevator and moving stairway manufacturing,not in scope,FALSE
333922,conveyor and conveying equipment manufacturing,not in scope,FALSE
333923,"overhead traveling crane, hoist, and monorail system manufacturing",not in scope,FALSE
333924,"industrial truck, tractor, trailer, and stacker machinery manufacturing",not in scope,FALSE
333991,power-driven handtool manufacturing,not in scope,FALSE
333992,welding and soldering equipment manufacturing,not in scope,FALSE
333993,packaging machinery manufacturing,not in scope,FALSE
333994,industrial process furnace and oven manufacturing,not in scope,FALSE
333995,fluid power cylinder and actuator manufacturing,not in scope,FALSE
333996,fluid power pump and motor manufacturing,not in scope,FALSE
333997,scale and balance manufacturing,not in scope,FALSE
333999,all other miscellaneous general purpose machinery manufacturing,not in scope,FALSE
334111,electronic computer manufacturing,not in scope,FALSE
334112,computer storage device manufacturing,not in scope,FALSE
334118,computer terminal and other computer peripheral equipment manufacturing,not in scope,FALSE
334210,telephone apparatus manufacturing,not in scope,FALSE
334220,radio and television broadcasting and wireless communications equipment manufacturing,not in scope,FALSE
334290,other communications equipment manufacturing,not in scope,FALSE
334310,audio and video equipment manufacturing,not in scope,FALSE
334412,bare printed circuit board manufacturing,not in scope,FALSE
