code,naics_title,sector,borderline
334413,semiconductor and related device manufacturing,not in scope,FALSE
334416,"capacitor, resistor, coil, transformer, and other inductor manufacturing",not in scope,FALSE
334417,electronic connector manufacturing,not in scope,FALSE
334418,printed circuit assembly (electronic assembly) manufacturing,not in scope,FALSE
334419,other electronic component manufacturing,not in scope,FALSE
334510,electromedical and electrotherapeutic apparatus manufacturing,not in scope,FALSE
334511,"search, detection, navigation, guidance, aeronautical, and nautical system and instrument manufacturing",not in scope,FALSE
334512,"automatic environmental control manufacturing for residential, commercial, and appliance use",not in scope,FALSE
334513,"instruments and related products manufacturing for measuring, displaying, and controlling industrial process variables",not in scope,FALSE
334514,totalizing fluid meter and counting device manufacturing,not in scope,FALSE
334515,instrument manufacturing for measuring and testing electricity and electrical signals,not in scope,FALSE
334516,analytical laboratory instrument manufacturing,not in scope,FALSE
334517,irradiation apparatus manufacturing,not in scope,FALSE
334519,other measuring and controlling device manufacturing,not in scope,FALSE
334613,blank magnetic and optical recording media manufacturing,not in scope,FALSE
334614,"software and other prerecorded compact disc, tape, and record reproducing",not in scope,FALSE
335110,electric lamp bulb and part manufacturing,not in scope,FALSE
335121,residential electric lighting fixture manufacturing,not in scope,FALSE
335122,"commercial, industrial, and institutional electric lighting fixture manufacturing",not in scope,FALSE
335129,other lighting equipment manufacturing,not in scope,FALSE
335210,small electrical appliance manufacturing,not in scope,FALSE
335220,major household appliance manufacturing,not in scope,FALSE
335311,"power, distribution, and specialty transformer manufacturing",not in scope,FALSE
335312,motor and generator manufacturing,not in scope,FALSE
335313,switchgear and switchboard apparatus manufacturing,not in scope,FALSE
335314,relay and industrial control manufacturing,not in scope,FALSE
335911,storage battery manufacturing,not in scope,FALSE
335912,primary battery manufacturing,not in scope,FALSE
335921,fiber optic cable manufacturing,not in scope,FALSE
335929,other communication and energy wire manufacturing,not in scope,FALSE
335931,current-carrying wiring device manufacturing,not in scope,FALSE
335932,noncurrent-carrying wiring device manufacturing,not in scope,FALSE
335991,carbon and graphite product manufacturing,not in scope,FALSE
335999,all other miscellaneous electrical equipment and component manufacturing,not in scope,FALSE
336111,automobile manufacturing,automotive,FALSE
336112,light truck and utility vehicle manufacturing,automotive,FALSE
336120,heavy duty truck manufacturing,automotive,FALSE
336211,motor vehicle body manufacturing,not in scope,FALSE
336212,truck trailer manufacturing,not in scope,FALSE
336213,motor home manufacturing,not in scope,FALSE
336214,travel trailer and camper manufacturing,not in scope,FALSE
336310,motor vehicle gasoline engine and engine parts manufacturing,not in scope,FALSE
336320,motor vehicle electrical and electronic equipment manufacturing,not in scope,FALSE
336330,motor vehicle steering and suspension components (except spring) manufacturing,not in scope,FALSE
336340,motor vehicle brake system manufacturing,not in scope,FALSE
336350,motor vehicle transmission and power train parts manufacturing,not in scope,FALSE
336360,motor vehicle seating and interior trim manufacturing,not in scope,FALSE
336370,motor vehicle metal stamping,not in scope,FALSE
336390,other motor vehicle parts manufacturing,not in scope,FALSE
336411,aircraft manufacturing,not in scope,FALSE
336412,aircraft engine and engine parts manufacturing,not in scope,FALSE
336413,other aircraft parts and auxiliary equipment manufacturing,not in scope,FALSE
336414,guided missile and space vehicle manufacturing,not in scope,FALSE
336415,guided missile and space vehicle propulsion unit and propulsion unit parts manufacturing,not in scope,FALSE
336419,other guided missile and space vehicle parts and auxiliary equipment manufacturing,not in scope,FALSE
336510,railroad rolling stock manufacturing,not in scope,FALSE
336611,ship building and repairing,not in scope,FALSE
336612,boat building,not in scope,FALSE
336991,"motorcycle, bicycle, and parts manufacturing",not in scope,FALSE
336992,"military armored vehicle, tank, and tank component manufacturing",not in scope,FALSE
336999,all other transportation equipment manufacturing,not in scope,FALSE
337110,wood kitchen cabinet and countertop manufacturing,not in scope,FALSE
337121,upholstered household furniture manufacturing,not in scope,FALSE
337122,nonupholstered wood household furniture manufacturing,not in scope,FALSE
337124,metal household furniture manufacturing,not in scope,FALSE
337125,household furniture (except wood and metal) manufacturing,not in scope,FALSE
337127,institutional furniture manufacturing,not in scope,FALSE
337211,wood office furniture manufacturing,not in scope,FALSE
337212,custom architectural woodwork and millwork manufacturing,not in scope,FALSE
337214,office furniture (except wood) manufacturing,not in scope,FALSE
337215,"showcase, partition, shelving, and locker manufacturing",not in scope,FALSE
337910,mattress manufacturing,not in scope,FALSE
337920,blind and shade manufacturing,not in scope,FALSE
339112,surgical and medical instrument manufacturing,not in scope,FALSE
339113,surgical appliance and supplies manufacturing,not in scope,FALSE
339114,dental equipment and supplies manufacturing,not in scope,FALSE
339115,ophthalmic goods manufacturing,not in scope,FALSE
339116,dental laboratories,not in scope,FALSE
339910,jewelry and silverware manufacturing,not in scope,FALSE
339920,sporting and athletic goods manufacturing,not in scope,FALSE
339930,"doll, toy, and game manufacturing",not in scope,FALSE
339940,office supplies (except paper) manufacturing,not in scope,FALSE
339950,sign manufacturing,not in scope,FALSE
339991,"gasket, packing, and sealing device manufacturing",not in scope,FALSE
339992,musical instrument manufacturing,not in scope,FALSE
339993,"fastener, button, needle, and pin manufacturing",not in scope,FALSE
339994,"broom, brush, and mop manufacturing",not in scope,FALSE
339995,burial casket manufacturing,not in scope,FALSE
339999,all other miscellaneous manufacturing,not in scope,FALSE
423110,automobile and other motor vehicle merchant wholesalers,not in scope,FALSE
423120,motor vehicle supplies and new parts merchant wholesalers,not in scope,FALSE
423130,tire and tube merchant wholesalers,not in scope,FALSE
423140,motor vehicle parts (used) merchant wholesalers,not in scope,FALSE
423210,furniture merchant wholesalers,not in scope,FALSE
423220,home furnishing merchant wholesalers,not in scope,FALSE
423310,"lumber, plywood, millwork, and wood panel merchant wholesalers",not in scope,FALSE
423320,"brick, stone, and related construction material merchant wholesalers",not in scope,FALSE
423330,"roofing, siding, and insulation material merchant wholesalers",not in scope,FALSE
423390,other construction material merchant wholesalers,not in scope,FALSE
423410,photographic equipment and supplies merchant wholesalers,not in scope,FALSE
423420,office equipment merchant wholesalers,not in scope,FALSE
423430,computer and computer peripheral equipment and software merchant wholesalers,not in scope,FALSE
423440,other commercial equipment merchant wholesalers,not in scope,FALSE
423450,"medical, dental, and hospital equipment and supplies merchant wholesalers",not in scope,FALSE
423460,ophthalmic goods merchant wholesalers,not in scope,FALSE
423490,other professional equipment and supplies merchant wholesalers,not in scope,FALSE
423510,metal service centers and other metal merchant wholesalers,not in scope,FALSE
423520,coal and other mineral and ore merchant wholesalers,not in scope,FALSE
423610,"electrical apparatus and equipment, wiring supplies, and related equipment merchant wholesalers",not in scope,FALSE
423620,"household appliances, electric housewares, and consumer electronics merchant wholesalers",not in scope,FALSE
423690,other electronic parts and equipment merchant wholesalers,not in scope,FALSE
423710,hardware merchant wholesalers,not in scope,FALSE
423720,plumbing and heating equipment and supplies (hydronics) merchant wholesalers,not in scope,FALSE
423730,warm air heating and air-conditioning equipment and supplies merchant wholesalers,not in scope,FALSE
423740,refrigeration equipment and supplies merchant wholesalers,not in scope,FALSE
423810,construction and mining (except oil well) machinery and equipment merchant wholesalers,not in scope,FALSE
423820,farm and garden machinery and equipment merchant wholesalers,not in scope,FALSE
423830,industrial machinery and equipment merchant wholesalers,not in scope,FALSE
423840,industrial supplies merchant wholesalers,not in scope,FALSE
423850,service establishment equipment and supplies merchant wholesalers,not in scope,FALSE
423860,transportation equipment and supplies (except motor vehicle) merchant wholesalers,not in scope,FALSE
423910,sporting and recreational goods and supplies merchant wholesalers,not in scope,FALSE
423920,toy and hobby goods and supplies merchant wholesalers,not in scope,FALSE
423930,recyclable material merchant wholesalers,not in scope,FALSE
423940,"jewelry, watch, precious stone, and precious metal merchant wholesalers",not in scope,FALSE
423990,other miscellaneous durable goods merchant wholesalers,not in scope,FALSE
424110,printing and writing paper merchant wholesalers,not in scope,FALSE
424120,stationery and office supplies merchant wholesalers,not in scope,FALSE
424130,industrial and personal service paper merchant wholesalers,not in scope,FALSE
424210,drugs and druggists' sundries merchant wholesalers,not in scope,FALSE
424310,"piece goods, notions, and other dry goods merchant wholesalers",not in scope,FALSE
424320,men's and boys' clothing and furnishings merchant wholesalers,not in scope,FALSE
424330,"women's, children's, and infants' clothing and accessories merchant wholesalers",not in scope,FALSE
424340,footwear merchant wholesalers,not in scope,FALSE
424410,general line grocery merchant wholesalers,not in scope,FALSE
424420,packaged frozen food merchant wholesalers,not in scope,FALSE
424430,dairy product (except dried or canned) merchant wholesalers,not in scope,FALSE
424440,poultry and poultry product merchant wholesalers,not in scope,FALSE
424450,confectionery merchant wholesalers,not in scope,FALSE
424460,fish and seafood merchant wholesalers,not in scope,FALSE
424470,meat and meat product merchant wholesalers,not in scope,FALSE
424480,fresh fruit and vegetable merchant wholesalers,not in scope,FALSE
424490,other grocery and related products merchant wholesalers,not in scope,FALSE
424510,grain and field bean merchant wholesalers,not in scope,FALSE
424520,livestock merchant wholesalers,not in scope,FALSE
424590,other farm product raw material merchant wholesalers,not in scope,FALSE
424610,plastics materials and basic forms and shapes merchant wholesalers,not in scope,FALSE
424690,other chemical and allied products merchant wholesalers,not in scope,FALSE
424710,petroleum bulk stations and terminals,not in scope,FALSE
424720,petroleum and petroleum products merchant wholesalers (except bulk stations and terminals),not in scope,FALSE
424810,beer and ale merchant wholesalers,not in scope,FALSE
424820,wine and distilled alcoholic beverage merchant wholesalers,not in scope,FALSE
424910,farm supplies merchant wholesalers,not in scope,FALSE
424920,"book, periodical, and newspaper merchant wholesalers",not in scope,FALSE
424930,"flower, nursery stock, and florists' supplies merchant wholesalers",not in scope,FALSE
424940,tobacco and tobacco product merchant wholesalers,not in scope,FALSE
424950,"paint, varnish, and supplies merchant wholesalers",not in scope,FALSE
424990,other miscellaneous nondurable goods merchant wholesalers,not in scope,FALSE
425110,business to business electronic markets,not in scope,FALSE
425120,wholesale trade agents and brokers,not in scope,FALSE
441110,new car dealers,not in scope,FALSE
441120,used car dealers,not in scope,FALSE
441210,recreational vehicle dealers,not in scope,FALSE
441222,boat dealers,not in scope,FALSE
441228,"motorcycle, atv, and all other motor vehicle dealers",not in scope,FALSE
441310,automotive parts and accessories stores,not in scope,FALSE
441320,tire dealers,not in scope,FALSE
442110,furniture stores,not in scope,FALSE
442210,floor covering stores,not in scope,FALSE
442291,window treatment stores,not in scope,FALSE
442299,all other home furnishings stores,not in scope,FALSE
443141,household appliance stores,not in scope,FALSE
443142,electronics stores,not in scope,FALSE
444110,home centers,not in scope,FALSE
444120,paint and wallpaper stores,not in scope,FALSE
444130,hardware stores,not in scope,FALSE
444190,other building material dealers,not in scope,FALSE
444210,outdoor power equipment stores,not in scope,FALSE
444220,"nursery, garden center, and farm supply stores",not in scope,FALSE
445110,supermarkets and other grocery (except convenience) stores,not in scope,FALSE
445120,convenience stores,not in scope,FALSE
445210,meat markets,not in scope,FALSE
445220,fish and seafood markets,not in scope,FALSE
445230,fruit and vegetable markets,not in scope,FALSE
445291,baked goods stores,not in scope,FALSE
445292,confectionery and nut stores,not in scope,FALSE
445299,all other specialty food stores,not in scope,FALSE
445310,"beer, wine, and liquor stores",not in scope,FALSE
446110,pharmacies and drug stores,not in scope,FALSE
446120,"cosmetics, beauty supplies, and perfume stores",not in scope,FALSE
446130,optical goods stores,not in scope,FALSE
446191,food (health) supplement stores,not in scope,FALSE
446199,all other health and personal care stores,not in scope,FALSE
447110,gasoline stations with convenience stores,not in scope,FALSE
447190,other gasoline stations,not in scope,FALSE
448110,men's clothing stores,not in scope,FALSE
448120,women's clothing stores,not in scope,FALSE
448130,children's and infants' clothing stores,not in scope,FALSE
448140,family clothing stores,not in scope,FALSE
448150,clothing accessories stores,not in scope,FALSE
448190,other clothing stores,not in scope,FALSE
448210,shoe stores,not in scope,FALSE
448310,jewelry stores,not in scope,FALSE
448320,luggage and leather goods stores,not in scope,FALSE
451110,sporting goods stores,not in scope,FALSE
451120,"hobby, toy, and game stores",not in scope,FALSE
451130,"sewing, needlework, and piece goods stores",not in scope,FALSE
451140,musical instrument and supplies stores,not in scope,FALSE
451211,book stores,not in scope,FALSE
451212,news dealers and newsstands,not in scope,FALSE
452210,department stores,not in scope,FALSE
452311,warehouse clubs and supercenters,not in scope,FALSE
452319,all other general merchandise stores,not in scope,FALSE
453110,florists,not in scope,FALSE
453210,office supplies and stationery stores,not in scope,FALSE
453220,"gift, novelty, and souvenir stores",not in scope,FALSE
453310,used merchandise stores,not in scope,FALSE
453910,pet and pet supplies stores,not in scope,FALSE
453920,art dealers,not in scope,FALSE
453930,manufactured (mobile) home dealers,not in scope,FALSE
453991,tobacco stores,not in scope,FALSE
453998,all other miscellaneous store retailers (except tobacco stores),not in scope,FALSE
454110,electronic shopping and mail-order houses,not in scope,FALSE
454210,vending machine operators,not in scope,FALSE
454310,fuel dealers,not in scope,FALSE
454390,other direct selling establishments,not in scope,FALSE
481111,scheduled passenger air transportation,aviation,FALSE
481112,scheduled freight air transportation,aviation,FALSE
481211,nonscheduled chartered passenger air transportation,aviation,FALSE
481212,nonscheduled chartered freight air transportation,aviation,FALSE
481219,other nonscheduled air transportation,aviation,FALSE
482111,line-haul railroads,not in scope,FALSE
482112,short line railroads,not in scope,FALSE
483111,deep sea freight transportation,shipping,FALSE
483112,deep sea passenger transportation,not in scope,FALSE
483113,coastal and great lakes freight transportation,shipping,FALSE
483114,coastal and great lakes passenger transportation,not in scope,FALSE
483211,inland water freight transportation,shipping,FALSE
483212,inland water passenger transportation,not in scope,FALSE
484110,"general freight trucking, local",not in scope,FALSE
484121,"general freight trucking, long-distance, truckload",not in scope,FALSE
484122,"general freight trucking, long-distance, less than truckload",not in scope,FALSE
484210,used household and office goods moving,not in scope,FALSE
484220,"specialized freight (except used goods) trucking, local",not in scope,FALSE
484230,"specialized freight (except used goods) trucking, long-distance",not in scope,FALSE
485111,mixed mode transit systems,not in scope,FALSE
485112,commuter rail systems,not in scope,FALSE
485113,bus and other motor vehicle transit systems,not in scope,FALSE
485119,other urban transit systems,not in scope,FALSE
485210,interurban and rural bus transportation,not in scope,FALSE
485310,taxi service,not in scope,FALSE
485320,limousine service,not in scope,FALSE
485410,school and employee bus transportation,not in scope,FALSE
485510,charter bus industry,not in scope,FALSE
485991,special needs transportation,not in scope,FALSE
485999,all other transit and ground passenger transportation,not in scope,FALSE
486110,pipeline transportation of crude oil,not in scope,FALSE
486210,pipeline transportation of natural gas,not in scope,FALSE
486910,pipeline transportation of refined petroleum products,not in scope,FALSE
486990,all other pipeline transportation,not in scope,FALSE
487110,"scenic and sightseeing transportation, land",not in scope,FALSE
487210,"scenic and sightseeing transportation, water",not in scope,FALSE
487990,"scenic and sightseeing transportation, other",not in scope,FALSE
488111,air traffic control,not in scope,FALSE
488119,other airport operations,not in scope,FALSE
488190,other support activities for air transportation,not in scope,FALSE
488210,support activities for rail transportation,not in scope,FALSE
488310,port and harbor operations,not in scope,FALSE
488320,marine cargo handling,not in scope,FALSE
488330,navigational services to shipping,not in scope,FALSE
488390,other support activities for water transportation,not in scope,FALSE
488410,motor vehicle towing,not in scope,FALSE
488490,other support activities for road transportation,not in scope,FALSE
488510,freight transportation arrangement,not in scope,FALSE
488991,packing and crating,not in scope,FALSE
488999,all other support activities for transportation,not in scope,FALSE
491110,postal service,not in scope,FALSE
492110,couriers and express delivery services,not in scope,FALSE
492210,local messengers and local delivery,not in scope,FALSE
493110,general warehousing and storage,not in scope,FALSE
493120,refrigerated warehousing and storage,not in scope,FALSE
493130,farm product warehousing and storage,not in scope,FALSE
493190,other warehousing and storage,not in scope,FALSE
511110,newspaper publishers,not in scope,FALSE
511120,periodical publishers,not in scope,FALSE
511130,book publishers,not in scope,FALSE
511140,directory and mailing list publishers,not in scope,FALSE
511191,greeting card publishers,not in scope,FALSE
511199,all other publishers,not in scope,FALSE
511210,software publishers,not in scope,FALSE
512110,motion picture and video production,not in scope,FALSE
512120,motion picture and video distribution,not in scope,FALSE
512131,motion picture theaters (except drive-ins),not in scope,FALSE
512132,drive-in motion picture theaters,not in scope,FALSE
512191,teleproduction and other postproduction services,not in scope,FALSE
512199,other motion picture and video industries,not in scope,FALSE
512230,music publishers,not in scope,FALSE
512240,sound recording studios,not in scope,FALSE
512250,record production and distribution,not in scope,FALSE
512290,other sound recording industries,not in scope,FALSE
515111,radio networks,not in scope,FALSE
515112,radio stations,not in scope,FALSE
515120,television broadcasting,not in scope,FALSE
515210,cable and other subscription programming,not in scope,FALSE
517311,wired telecommunications carriers,not in scope,FALSE
517312,wireless telecommunications carriers (except satellite),not in scope,FALSE
517410,satellite telecommunications,not in scope,FALSE
517911,telecommunications resellers,not in scope,FALSE
517919,all other telecommunications,not in scope,FALSE
518210,"data processing, hosting, and related services",not in scope,FALSE
519110,news syndicates,not in scope,FALSE
519120,libraries and archives,not in scope,FALSE
519130,internet publishing and broadcasting and web search portals,not in scope,FALSE
519190,all other information services,not in scope,FALSE
521110,monetary authorities-central bank,not in scope,FALSE
522110,commercial banking,not in scope,FALSE
522120,savings institutions,not in scope,FALSE
522130,credit unions,not in scope,FALSE
522190,other depository credit intermediation,not in scope,FALSE
522210,credit card issuing,not in scope,FALSE
522220,sales financing,not in scope,FALSE
522291,consumer lending,not in scope,FALSE
522292,real estate credit,not in scope,FALSE
522293,international trade financing,not in scope,FALSE
522294,secondary market financing,not in scope,FALSE
522298,all other nondepository credit intermediation,not in scope,FALSE
522310,mortgage and nonmortgage loan brokers,not in scope,FALSE
522320,"financial transactions processing, reserve, and clearinghouse activities",not in scope,FALSE
522390,other activities related to credit intermediation,not in scope,FALSE
523110,investment banking and securities dealing,not in scope,FALSE
523120,securities brokerage,not in scope,FALSE
523130,commodity contracts dealing,not in scope,FALSE
523140,commodity contracts brokerage,not in scope,FALSE
523210,securities and commodity exchanges,not in scope,FALSE
523910,miscellaneous intermediation,not in scope,FALSE
523920,portfolio management,not in scope,FALSE
523930,investment advice,not in scope,FALSE
523991,"trust, fiduciary, and custody activities",not in scope,FALSE
523999,miscellaneous financial investment activities,not in scope,FALSE
524113,direct life insurance carriers,not in scope,FALSE
524114,direct health and medical insurance carriers,not in scope,FALSE
524126,direct property and casualty insurance carriers,not in scope,FALSE
524127,direct title insurance carriers,not in scope,FALSE
524128,"other direct insurance (except life, health, and medical) carriers",not in scope,FALSE
524130,reinsurance carriers,not in scope,FALSE
524210,insurance agencies and brokerages,not in scope,FALSE
524291,claims adjusting,not in scope,FALSE
524292,third party administration of insurance and pension funds,not in scope,FALSE
524298,all other insurance related activities,not in scope,FALSE
525110,pension funds,not in scope,FALSE
525120,health and welfare funds,not in scope,FALSE
525190,other insurance funds,not in scope,FALSE
525910,open-end investment funds,not in scope,FALSE
525920,"trusts, estates, and agency accounts",not in scope,FALSE
525990,other financial vehicles,not in scope,FALSE
531110,lessors of residential buildings and dwellings,not in scope,FALSE
531120,lessors of nonresidential buildings (except miniwarehouses),not in scope,FALSE
531130,lessors of miniwarehouses and self-storage units,not in scope,FALSE
531190,lessors of other real estate property,not in scope,FALSE
531210,offices of real estate agents and brokers,not in scope,FALSE
531311,residential property managers,not in scope,FALSE
531312,nonresidential property managers,not in scope,FALSE
531320,offices of real estate appraisers,not in scope,FALSE
531390,other activities related to real estate,not in scope,FALSE
532111,passenger car rental,not in scope,FALSE
532112,passenger car leasing,not in scope,FALSE
532120,"truck, utility trailer, and rv (recreational vehicle) rental and leasing",not in scope,FALSE
532210,consumer electronics and appliances rental,not in scope,FALSE
532281,formal wear and costume rental,not in scope,FALSE
532282,video tape and disc rental,not in scope,FALSE
532283,home health equipment rental,not in scope,FALSE
532284,recreational goods rental,not in scope,FALSE
532289,all other consumer goods rental,not in scope,FALSE
532310,general rental centers,not in scope,FALSE
532411,"commercial air, rail, and water transportation equipment rental and leasing",not in scope,FALSE
532412,"construction, mining, and forestry machinery and equipment rental and leasing",not in scope,FALSE
532420,office machinery and equipment rental and leasing,not in scope,FALSE
532490,other commercial and industrial machinery and equipment rental and leasing,not in scope,FALSE
533110,lessors of nonfinancial intangible assets (except copyrighted works),not in scope,FALSE
541110,offices of lawyers,not in scope,FALSE
541120,offices of notaries,not in scope,FALSE
541191,title abstract and settlement offices,not in scope,FALSE
541199,all other legal services,not in scope,FALSE
541211,offices of certified public accountants,not in scope,FALSE
541213,tax preparation services,not in scope,FALSE
541214,payroll services,not in scope,FALSE
541219,other accounting services,not in scope,FALSE
541310,architectural services,not in scope,FALSE
541320,landscape architectural services,not in scope,FALSE
541330,engineering services,not in scope,FALSE
541340,drafting services,not in scope,FALSE
